{
  "analysis_id": "CDNA-001-PHASE-001",
  "case_id": "CDNA-001",
  "disclaimer": "Phase boundaries are recommendation switches under planning assumptions only. They are not biological phase transitions, causal confidence, or evidence.",
  "sensitivity_analysis_ref": "CDNA-001-SENS-001",
  "objective": "conservative_information_gain_per_cost",
  "target_experiment_id": "E5_MATCHED_MULTIOMIC",
  "target_cost_multipliers": [0.4, 0.5, 0.6, 0.7, 0.8, 0.9, 1.0, 1.1, 1.2, 1.3, 1.4, 1.5, 1.6],
  "target_reliabilities": [0.5, 0.6, 0.7, 0.8, 0.9, 1.0],
  "outcome_probability_max_transfers": [0.0, 0.05, 0.1, 0.15],
  "competitor_reliability": 1.0,
  "include_stop": true
}
